{
  "$schema": "http://json-schema.org/draft-07/schema#",
  "$id": "https://kurs.example/wewnetrzne/podpowiedzi-2020-12",
  "title": "JSON Schema 2020-12 (podpowiedzi po polsku)",
  "$ref": "#/definitions/schemat",
  "definitions": {
    "schemat": {
      "type": ["object", "boolean"],
      "properties": {
        "$schema": { "type": "string", "format": "uri", "markdownDescription": "`$schema` — adres metaschematu, czyli wersji JSON Schema, w której napisano ten schemat. Dla 2020-12: `https://json-schema.org/draft/2020-12/schema`.", "enum": ["https://json-schema.org/draft/2020-12/schema"] },
        "$id": { "type": "string", "markdownDescription": "`$id` — identyfikator schematu (URI). To nazwa, a nie adres do pobrania: walidator niczego nie ściąga z sieci." },
        "$ref": { "type": "string", "markdownDescription": "`$ref` — odwołanie do innego schematu: `#/$defs/nazwa` w tym samym pliku albo `$id` innego pliku. W 2020-12 słowa obok `$ref` nadal działają." },
        "$anchor": { "type": "string", "markdownDescription": "`$anchor` — nazwa fragmentu, do której można się odwołać przez `#nazwa` zamiast długiego JSON Pointera." },
        "$dynamicRef": { "type": "string", "markdownDescription": "`$dynamicRef` — odwołanie dynamiczne (zaawansowane, poza zakresem kursu)." },
        "$dynamicAnchor": { "type": "string", "markdownDescription": "`$dynamicAnchor` — kotwica dynamiczna (zaawansowane, poza zakresem kursu)." },
        "$vocabulary": { "type": "object", "markdownDescription": "`$vocabulary` — słowniki używane przez metaschemat (tylko w metaschematach)." },
        "$comment": { "type": "string", "markdownDescription": "`$comment` — komentarz dla autorów schematu. Walidator go ignoruje." },
        "$defs": { "type": "object", "additionalProperties": { "$ref": "#/definitions/schemat" }, "markdownDescription": "`$defs` — miejsce na definicje wielokrotnego użytku, do których odwołujesz się przez `$ref: \"#/$defs/nazwa\"`. W draft-07 nazywało się `definitions`." },
        "definitions": { "type": "object", "additionalProperties": { "$ref": "#/definitions/schemat" }, "markdownDescription": "`definitions` — stara nazwa `$defs` z draft-07. W 2020-12 nadal działa jako zwykłe miejsce na schematy, ale zalecane jest `$defs`." },
        "type": { "anyOf": [{ "$ref": "#/definitions/typ" }, { "type": "array", "items": { "$ref": "#/definitions/typ" }, "uniqueItems": true }], "markdownDescription": "`type` — typ wartości: `\"string\"`, `\"number\"`, `\"integer\"`, `\"boolean\"`, `\"object\"`, `\"array\"`, `\"null\"` albo lista kilku typów, np. `[\"string\", \"null\"]`." },
        "enum": { "type": "array", "markdownDescription": "`enum` — lista dozwolonych wartości. Wartość musi być dokładnie równa jednej z nich (liczy się wielkość liter)." },
        "const": { "markdownDescription": "`const` — jedna jedyna dozwolona wartość. To samo, co `enum` z jednym elementem." },
        "multipleOf": { "type": "number", "exclusiveMinimum": 0, "markdownDescription": "`multipleOf` — liczba musi być wielokrotnością podanej wartości, np. `36` dla opakowań zbiorczych. Ułamki dziesiętne bywają zawodne przez arytmetykę zmiennoprzecinkową." },
        "maximum": { "type": "number", "markdownDescription": "`maximum` — największa dozwolona liczba (włącznie)." },
        "exclusiveMaximum": { "type": "number", "markdownDescription": "`exclusiveMaximum` — liczba musi być mniejsza niż podana (granica wyłączona). W draft-07 było to `true`/`false` obok `maximum`." },
        "minimum": { "type": "number", "markdownDescription": "`minimum` — najmniejsza dozwolona liczba (włącznie)." },
        "exclusiveMinimum": { "type": "number", "markdownDescription": "`exclusiveMinimum` — liczba musi być większa niż podana (granica wyłączona). W draft-07 było to `true`/`false` obok `minimum`." },
        "maxLength": { "type": "integer", "minimum": 0, "markdownDescription": "`maxLength` — największa dozwolona liczba znaków tekstu." },
        "minLength": { "type": "integer", "minimum": 0, "markdownDescription": "`minLength` — najmniejsza dozwolona liczba znaków tekstu. `1` odrzuca pusty tekst." },
        "pattern": { "type": "string", "format": "regex", "markdownDescription": "`pattern` — wyrażenie regularne (dialekt ECMA-262), do którego tekst ma pasować. Bez `^` i `$` wystarczy dopasowanie fragmentu. W JSON-ie `\\` trzeba podwoić." },
        "maxItems": { "type": "integer", "minimum": 0, "markdownDescription": "`maxItems` — największa dozwolona liczba elementów listy." },
        "minItems": { "type": "integer", "minimum": 0, "markdownDescription": "`minItems` — najmniejsza dozwolona liczba elementów listy. `1` odrzuca pustą listę." },
        "uniqueItems": { "type": "boolean", "markdownDescription": "`uniqueItems` — `true` oznacza, że elementy listy nie mogą się powtarzać (porównanie całych wartości)." },
        "maxContains": { "type": "integer", "minimum": 0, "markdownDescription": "`maxContains` — najwyżej tyle elementów może pasować do `contains`." },
        "minContains": { "type": "integer", "minimum": 0, "markdownDescription": "`minContains` — co najmniej tyle elementów musi pasować do `contains` (domyślnie 1)." },
        "maxProperties": { "type": "integer", "minimum": 0, "markdownDescription": "`maxProperties` — największa dozwolona liczba pól obiektu." },
        "minProperties": { "type": "integer", "minimum": 0, "markdownDescription": "`minProperties` — najmniejsza dozwolona liczba pól obiektu." },
        "required": { "type": "array", "items": { "type": "string" }, "uniqueItems": true, "markdownDescription": "`required` — lista nazw pól, które muszą wystąpić w obiekcie. Samo `properties` niczego nie wymaga." },
        "dependentRequired": { "type": "object", "additionalProperties": { "type": "array", "items": { "type": "string" } }, "markdownDescription": "`dependentRequired` — jeśli jest pole X, to muszą być też pola z listy, np. `{ \"nip\": [\"nazwaFirmy\"] }`. W draft-07: `dependencies`." },
        "allOf": { "type": "array", "items": { "$ref": "#/definitions/schemat" }, "markdownDescription": "`allOf` — wartość musi spełniać wszystkie podane schematy naraz." },
        "anyOf": { "type": "array", "items": { "$ref": "#/definitions/schemat" }, "markdownDescription": "`anyOf` — wartość musi spełniać co najmniej jeden z podanych schematów." },
        "oneOf": { "type": "array", "items": { "$ref": "#/definitions/schemat" }, "markdownDescription": "`oneOf` — wartość musi spełniać dokładnie jeden z podanych schematów. Gdy pasują dwa naraz, werdykt jest negatywny." },
        "not": { "$ref": "#/definitions/schemat", "markdownDescription": "`not` — wartość nie może spełniać podanego schematu." },
        "if": { "$ref": "#/definitions/schemat", "markdownDescription": "`if` — warunek: jeśli wartość spełnia ten schemat, stosuje się `then`, w przeciwnym razie `else`." },
        "then": { "$ref": "#/definitions/schemat", "markdownDescription": "`then` — schemat stosowany, gdy `if` jest spełnione." },
        "else": { "$ref": "#/definitions/schemat", "markdownDescription": "`else` — schemat stosowany, gdy `if` nie jest spełnione." },
        "dependentSchemas": { "type": "object", "additionalProperties": { "$ref": "#/definitions/schemat" }, "markdownDescription": "`dependentSchemas` — jeśli jest pole X, obiekt musi dodatkowo spełniać podany schemat." },
        "dependencies": { "type": "object", "markdownDescription": "`dependencies` — stare słowo z draft-07, zastąpione przez `dependentRequired` i `dependentSchemas`." },
        "prefixItems": { "type": "array", "items": { "$ref": "#/definitions/schemat" }, "markdownDescription": "`prefixItems` — schematy dla kolejnych pozycji listy (krotka), np. `[szerokość, wysokość, głębokość]`. W draft-07 była to tablica w `items`." },
        "items": { "$ref": "#/definitions/schemat", "markdownDescription": "`items` — schemat, który musi spełniać każdy element listy (po pozycjach z `prefixItems`, jeśli są). `false` zabrania dodatkowych elementów." },
        "additionalItems": { "$ref": "#/definitions/schemat", "markdownDescription": "`additionalItems` — stare słowo z draft-07; w 2020-12 jego rolę pełni `items` obok `prefixItems`." },
        "contains": { "$ref": "#/definitions/schemat", "markdownDescription": "`contains` — co najmniej jeden element listy musi spełniać ten schemat." },
        "properties": { "type": "object", "additionalProperties": { "$ref": "#/definitions/schemat" }, "markdownDescription": "`properties` — opis pól obiektu: nazwa → schemat. Nie wymusza obecności pola, do tego służy `required`." },
        "patternProperties": { "type": "object", "additionalProperties": { "$ref": "#/definitions/schemat" }, "markdownDescription": "`patternProperties` — schematy dla pól, których nazwy pasują do wyrażenia regularnego." },
        "additionalProperties": { "$ref": "#/definitions/schemat", "markdownDescription": "`additionalProperties` — co z polami spoza `properties`. Domyślnie wszystko wolno (literówki przechodzą). `false` zamyka obiekt." },
        "propertyNames": { "$ref": "#/definitions/schemat", "markdownDescription": "`propertyNames` — schemat, który muszą spełniać nazwy pól (jako teksty)." },
        "unevaluatedItems": { "$ref": "#/definitions/schemat", "markdownDescription": "`unevaluatedItems` — jak `items`, ale widzi też elementy opisane w `allOf`, `anyOf`, `if` itd." },
        "unevaluatedProperties": { "$ref": "#/definitions/schemat", "markdownDescription": "`unevaluatedProperties` — jak `additionalProperties`, ale widzi też pola opisane w `allOf`, `anyOf`, `if` itd. Ratunek na `additionalProperties: false` w gałęzi `allOf`." },
        "format": { "type": "string", "markdownDescription": "`format` — nazwa formatu tekstu: `date`, `date-time`, `email`, `uuid`, `uri`, `ipv4`… Domyślnie tylko adnotacja: walidator sprawdza go dopiero po włączeniu.", "enum": ["date", "date-time", "time", "duration", "email", "idn-email", "hostname", "idn-hostname", "ipv4", "ipv6", "uri", "uri-reference", "iri", "iri-reference", "uuid", "uri-template", "json-pointer", "relative-json-pointer", "regex"] },
        "contentEncoding": { "type": "string", "markdownDescription": "`contentEncoding` — kodowanie zawartości tekstu, np. `base64` (adnotacja)." },
        "contentMediaType": { "type": "string", "markdownDescription": "`contentMediaType` — typ MIME zawartości tekstu (adnotacja)." },
        "contentSchema": { "$ref": "#/definitions/schemat", "markdownDescription": "`contentSchema` — schemat zawartości zakodowanego tekstu (adnotacja)." },
        "title": { "type": "string", "markdownDescription": "`title` — krótki tytuł do dokumentacji. Niczego nie sprawdza." },
        "description": { "type": "string", "markdownDescription": "`description` — opis do dokumentacji. Niczego nie sprawdza." },
        "default": { "markdownDescription": "`default` — wartość domyślna dla dokumentacji i narzędzi. Walidator niczego nie wpisuje do danych." },
        "deprecated": { "type": "boolean", "markdownDescription": "`deprecated` — `true` oznacza, że pole jest przestarzałe i ma zniknąć. Adnotacja." },
        "readOnly": { "type": "boolean", "markdownDescription": "`readOnly` — pole nadaje system, klient go nie wysyła (np. numer zamówienia). Adnotacja." },
        "writeOnly": { "type": "boolean", "markdownDescription": "`writeOnly` — pole wysyła klient, a system nigdy go nie zwraca (np. token płatności). Adnotacja." },
        "examples": { "type": "array", "markdownDescription": "`examples` — przykładowe wartości do dokumentacji. Niczego nie sprawdza." }
      }
    },
    "typ": { "type": "string", "enum": ["string", "number", "integer", "boolean", "object", "array", "null"] }
  }
}
