{
  "type": "array",
  "minItems": 1,
  "maxItems": 50,
  "items": {
    "type": "object",
    "properties": {
      "ean": {
        "type": "string",
        "pattern": "^[0-9]{13}$"
      },
      "ilosc": {
        "type": "integer",
        "minimum": 1
      },
      "cena": {
        "type": "number",
        "exclusiveMinimum": 0
      }
    },
    "required": [
      "ean",
      "ilosc",
      "cena"
    ]
  }
}
