{
  "$id": "https://kurs.example/schematy/adres",
  "title": "Adres",
  "type": "object",
  "properties": {
    "ulica": { "type": "string", "minLength": 1 },
    "miasto": { "type": "string", "minLength": 1 },
    "kodPocztowy": { "type": "string", "pattern": "^[0-9]{2}-[0-9]{3}$" }
  },
  "required": ["ulica", "miasto", "kodPocztowy"]
}
