{
  "type": "object",
  "properties": {
    "ulica": {
      "type": "string"
    },
    "miasto": {
      "type": "string"
    },
    "kodPocztowy": {
      "type": "string",
      "pattern": "^[0-9]{2}-[0-9]{3}$"
    },
    "uwagi": {
      "type": "string"
    }
  },
  "required": [
    "ulica",
    "miasto",
    "kodPocztowy"
  ],
  "additionalProperties": false
}
