{
  "$id": "https://kurs.example/schematy/produkt",
  "title": "Produkt",
  "type": "object",
  "properties": {
    "ean": {
      "type": "string",
      "pattern": "^[0-9]{13}$"
    },
    "nazwa": {
      "type": "string"
    },
    "cena": {
      "type": "number",
      "exclusiveMinimum": 0
    }
  },
  "required": [
    "nazwa",
    "cena"
  ]
}
